{"schema":"original-book-v1","originalId":"sblgnt-macula","bookId":"philemon","title":"ΠΡΟΣ ΦΙΛΗΜΟΝΑ","chapters":[{"n":1,"verses":[{"ref":"philemon 1:1","n":1,"text":"Παῦλος δέσμιος Χριστοῦ Ἰησοῦ καὶ Τιμόθεος ὁ ἀδελφὸς Φιλήμονι τῷ ἀγαπητῷ καὶ συνεργῷ ἡμῶν","tokens":[{"id":"n57001001001","i":1,"s":"Παῦλος","lemma":"Παῦλος","lexemeKey":"paulos","maculaLexemeId":"grc-paylos-65b926","morph":"N-NSM","strongs":["3972"],"fw":false},{"id":"n57001001002","i":2,"s":"δέσμιος","lemma":"δέσμιος","lexemeKey":"desmios","maculaLexemeId":"grc-desmios-eb68a2","morph":"N-NSM","strongs":["1198"],"fw":false},{"id":"n57001001003","i":3,"s":"Χριστοῦ","lemma":"Χριστός","lexemeKey":"christos","maculaLexemeId":"grc-christos-7b2d70","morph":"N-GSM","strongs":["5547"],"fw":false},{"id":"n57001001004","i":4,"s":"Ἰησοῦ","lemma":"Ἰησοῦς","lexemeKey":"iesous","maculaLexemeId":"grc-iesoys-2fba61","morph":"N-GSM","strongs":["2424"],"fw":false},{"id":"n57001001005","i":5,"s":"καὶ","lemma":"καί","lexemeKey":"kai","maculaLexemeId":"grc-kai-85ac83","morph":"CONJ","strongs":["2532"],"fw":true},{"id":"n57001001006","i":6,"s":"Τιμόθεος","lemma":"Τιμόθεος","lexemeKey":"Timotheos","maculaLexemeId":"grc-timotheos-29ec3b","morph":"N-NSM","strongs":["5095"],"fw":false},{"id":"n57001001007","i":7,"s":"ὁ","lemma":"ὁ","lexemeKey":"ho","maculaLexemeId":"grc-o-677c59","morph":"T-NSM","strongs":["3588"],"fw":true},{"id":"n57001001008","i":8,"s":"ἀδελφὸς","lemma":"ἀδελφός","lexemeKey":"adelphos","maculaLexemeId":"grc-adelphos-a95ab7","morph":"N-NSM","strongs":["80"],"fw":false},{"id":"n57001001009","i":9,"s":"Φιλήμονι","lemma":"Φιλήμων","lexemeKey":"Philēmōn","maculaLexemeId":"grc-philemon-1fcf8b","morph":"N-DSM","strongs":["5371"],"fw":false},{"id":"n57001001010","i":10,"s":"τῷ","lemma":"ὁ","lexemeKey":"ho","maculaLexemeId":"grc-o-677c59","morph":"T-DSM","strongs":["3588"],"fw":true},{"id":"n57001001011","i":11,"s":"ἀγαπητῷ","lemma":"ἀγαπητός","lexemeKey":"agapētos","maculaLexemeId":"grc-agapetos-96f029","morph":"A-DSM","strongs":["27"],"fw":false},{"id":"n57001001012","i":12,"s":"καὶ","lemma":"καί","lexemeKey":"kai","maculaLexemeId":"grc-kai-85ac83","morph":"CONJ","strongs":["2532"],"fw":true},{"id":"n57001001013","i":13,"s":"συνεργῷ","lemma":"συνεργός","lexemeKey":"synergos","maculaLexemeId":"grc-synergos-036fd1","morph":"A-DSM","strongs":["4904"],"fw":false},{"id":"n57001001014","i":14,"s":"ἡμῶν","lemma":"ἐγώ","lexemeKey":"ego","maculaLexemeId":"grc-ego-94bdb8","morph":"P-1GP","strongs":["2257"],"fw":true}]},{"ref":"philemon 1:2","n":2,"text":"καὶ Ἀπφίᾳ τῇ ⸀ ἀδελφῇ καὶ Ἀρχίππῳ τῷ συστρατιώτῃ ἡμῶν καὶ τῇ κατʼ οἶκόν σου ἐκκλησίᾳ·","tokens":[{"id":"n57001002001","i":1,"s":"καὶ","lemma":"καί","lexemeKey":"kai","maculaLexemeId":"grc-kai-85ac83","morph":"CONJ","strongs":["2532"],"fw":true},{"id":"n57001002002","i":2,"s":"Ἀπφίᾳ","lemma":"Ἀπφία","lexemeKey":"Apphia","maculaLexemeId":"grc-apphia-45dd86","morph":"N-DSF","strongs":["682"],"fw":false},{"id":"n57001002003","i":3,"s":"τῇ","lemma":"ὁ","lexemeKey":"ho","maculaLexemeId":"grc-o-677c59","morph":"T-DSF","strongs":["3588"],"fw":true},{"id":"n57001002004","i":4,"s":"ἀδελφῇ","lemma":"ἀδελφή","lexemeKey":"adelphē","maculaLexemeId":"grc-adelphe-de6475","morph":"N-DSF","strongs":["79"],"fw":false},{"id":"n57001002005","i":5,"s":"καὶ","lemma":"καί","lexemeKey":"kai","maculaLexemeId":"grc-kai-85ac83","morph":"CONJ","strongs":["2532"],"fw":true},{"id":"n57001002006","i":6,"s":"Ἀρχίππῳ","lemma":"Ἄρχιππος","lexemeKey":"Archippos","maculaLexemeId":"grc-archippos-755d6c","morph":"N-DSM","strongs":["751"],"fw":false},{"id":"n57001002007","i":7,"s":"τῷ","lemma":"ὁ","lexemeKey":"ho","maculaLexemeId":"grc-o-677c59","morph":"T-DSM","strongs":["3588"],"fw":true},{"id":"n57001002008","i":8,"s":"συστρατιώτῃ","lemma":"συστρατιώτης","lexemeKey":"systratiōtēs","maculaLexemeId":"grc-systratiotes-7833d1","morph":"N-DSM","strongs":["4961"],"fw":false},{"id":"n57001002009","i":9,"s":"ἡμῶν","lemma":"ἐγώ","lexemeKey":"ego","maculaLexemeId":"grc-ego-94bdb8","morph":"P-1GP","strongs":["2257"],"fw":true},{"id":"n57001002010","i":10,"s":"καὶ","lemma":"καί","lexemeKey":"kai","maculaLexemeId":"grc-kai-85ac83","morph":"CONJ","strongs":["2532"],"fw":true},{"id":"n57001002011","i":11,"s":"τῇ","lemma":"ὁ","lexemeKey":"ho","maculaLexemeId":"grc-o-677c59","morph":"T-DSF","strongs":["3588"],"fw":true},{"id":"n57001002012","i":12,"s":"κατ","lemma":"κατά","lexemeKey":"kata","maculaLexemeId":"grc-kata-f335e2","morph":"PREP","strongs":["2596"],"fw":true},{"id":"n57001002013","i":13,"s":"οἶκόν","lemma":"οἶκος","lexemeKey":"oikos","maculaLexemeId":"grc-oikos-0d75dd","morph":"N-ASM","strongs":["3624"],"fw":false},{"id":"n57001002014","i":14,"s":"σου","lemma":"σύ","lexemeKey":"sy","maculaLexemeId":"grc-sy-fb8d01","morph":"P-2GS","strongs":["4675"],"fw":true},{"id":"n57001002015","i":15,"s":"ἐκκλησίᾳ","lemma":"ἐκκλησία","lexemeKey":"ekklesia","maculaLexemeId":"grc-ekklesia-1fb3f8","morph":"N-DSF","strongs":["1577"],"fw":false}]},{"ref":"philemon 1:3","n":3,"text":"χάρις ὑμῖν καὶ εἰρήνη ἀπὸ θεοῦ πατρὸς ἡμῶν καὶ κυρίου Ἰησοῦ Χριστοῦ.","tokens":[{"id":"n57001003001","i":1,"s":"χάρις","lemma":"χάρις","lexemeKey":"charis","maculaLexemeId":"grc-charis-163a0f","morph":"N-NSF","strongs":["5485"],"fw":false},{"id":"n57001003002","i":2,"s":"ὑμῖν","lemma":"σύ","lexemeKey":"sy","maculaLexemeId":"grc-sy-fb8d01","morph":"P-2DP","strongs":["5213"],"fw":true},{"id":"n57001003003","i":3,"s":"καὶ","lemma":"καί","lexemeKey":"kai","maculaLexemeId":"grc-kai-85ac83","morph":"CONJ","strongs":["2532"],"fw":true},{"id":"n57001003004","i":4,"s":"εἰρήνη","lemma":"εἰρήνη","lexemeKey":"eirene","maculaLexemeId":"grc-eirene-1a0c0a","morph":"N-NSF","strongs":["1515"],"fw":false},{"id":"n57001003005","i":5,"s":"ἀπὸ","lemma":"ἀπό","lexemeKey":"apo","maculaLexemeId":"grc-apo-344d3e","morph":"PREP","strongs":["575"],"fw":true},{"id":"n57001003006","i":6,"s":"θεοῦ","lemma":"θεός","lexemeKey":"theos","maculaLexemeId":"grc-theos-3f4df2","morph":"N-GSM","strongs":["2316"],"fw":false},{"id":"n57001003007","i":7,"s":"πατρὸς","lemma":"πατήρ","lexemeKey":"pater","maculaLexemeId":"grc-pater-7f1939","morph":"N-GSM","strongs":["3962"],"fw":false},{"id":"n57001003008","i":8,"s":"ἡμῶν","lemma":"ἐγώ","lexemeKey":"ego","maculaLexemeId":"grc-ego-94bdb8","morph":"P-1GP","strongs":["2257"],"fw":true},{"id":"n57001003009","i":9,"s":"καὶ","lemma":"καί","lexemeKey":"kai","maculaLexemeId":"grc-kai-85ac83","morph":"CONJ","strongs":["2532"],"fw":true},{"id":"n57001003010","i":10,"s":"κυρίου","lemma":"κύριος","lexemeKey":"kurios","maculaLexemeId":"grc-kyrios-f2f283","morph":"N-GSM","strongs":["2962"],"fw":false},{"id":"n57001003011","i":11,"s":"Ἰησοῦ","lemma":"Ἰησοῦς","lexemeKey":"iesous","maculaLexemeId":"grc-iesoys-2fba61","morph":"N-GSM","strongs":["2424"],"fw":false},{"id":"n57001003012","i":12,"s":"Χριστοῦ","lemma":"Χριστός","lexemeKey":"christos","maculaLexemeId":"grc-christos-7b2d70","morph":"N-GSM","strongs":["5547"],"fw":false}]},{"ref":"philemon 1:4","n":4,"text":"Εὐχαριστῶ τῷ θεῷ μου πάντοτε μνείαν σου ποιούμενος ἐπὶ τῶν προσευχῶν μου,","tokens":[{"id":"n57001004001","i":1,"s":"Εὐχαριστῶ","lemma":"εὐχαριστέω","lexemeKey":"eucharisteō","maculaLexemeId":"grc-eycharisteo-2ca0e5","morph":"V-PAI-1S","strongs":["2168"],"fw":false},{"id":"n57001004002","i":2,"s":"τῷ","lemma":"ὁ","lexemeKey":"ho","maculaLexemeId":"grc-o-677c59","morph":"T-DSM","strongs":["3588"],"fw":true},{"id":"n57001004003","i":3,"s":"θεῷ","lemma":"θεός","lexemeKey":"theos","maculaLexemeId":"grc-theos-3f4df2","morph":"N-DSM","strongs":["2316"],"fw":false},{"id":"n57001004004","i":4,"s":"μου","lemma":"ἐγώ","lexemeKey":"ego","maculaLexemeId":"grc-ego-94bdb8","morph":"P-1GS","strongs":["3450"],"fw":true},{"id":"n57001004005","i":5,"s":"πάντοτε","lemma":"πάντοτε","lexemeKey":"pantote","maculaLexemeId":"grc-pantote-4be539","morph":"ADV","strongs":["3842"],"fw":false},{"id":"n57001004006","i":6,"s":"μνείαν","lemma":"μνεία","lexemeKey":"mneia","maculaLexemeId":"grc-mneia-263d96","morph":"N-ASF","strongs":["3417"],"fw":false},{"id":"n57001004007","i":7,"s":"σου","lemma":"σύ","lexemeKey":"sy","maculaLexemeId":"grc-sy-fb8d01","morph":"P-2GS","strongs":["4675"],"fw":true},{"id":"n57001004008","i":8,"s":"ποιούμενος","lemma":"ποιέω","lexemeKey":"poieo","maculaLexemeId":"grc-poieo-a3d87e","morph":"V-PMP-NSM","strongs":["4160"],"fw":false},{"id":"n57001004009","i":9,"s":"ἐπὶ","lemma":"ἐπί","lexemeKey":"epi","maculaLexemeId":"grc-epi-5d81b1","morph":"PREP","strongs":["1909"],"fw":true},{"id":"n57001004010","i":10,"s":"τῶν","lemma":"ὁ","lexemeKey":"ho","maculaLexemeId":"grc-o-677c59","morph":"T-GPF","strongs":["3588"],"fw":true},{"id":"n57001004011","i":11,"s":"προσευχῶν","lemma":"προσευχή","lexemeKey":"proseuchē","maculaLexemeId":"grc-proseyche-d82809","morph":"N-GPF","strongs":["4335"],"fw":false},{"id":"n57001004012","i":12,"s":"μου","lemma":"ἐγώ","lexemeKey":"ego","maculaLexemeId":"grc-ego-94bdb8","morph":"P-1GS","strongs":["3450"],"fw":true}]},{"ref":"philemon 1:5","n":5,"text":"ἀκούων σου τὴν ἀγάπην καὶ τὴν πίστιν ἣν ἔχεις ⸀ πρὸς τὸν κύριον Ἰησοῦν καὶ εἰς πάντας τοὺς ἁγίους,","tokens":[{"id":"n57001005001","i":1,"s":"ἀκούων","lemma":"ἀκούω","lexemeKey":"akouo","maculaLexemeId":"grc-akoyo-914df6","morph":"V-PAP-NSM","strongs":["191"],"fw":false},{"id":"n57001005002","i":2,"s":"σου","lemma":"σύ","lexemeKey":"sy","maculaLexemeId":"grc-sy-fb8d01","morph":"P-2GS","strongs":["4675"],"fw":true},{"id":"n57001005003","i":3,"s":"τὴν","lemma":"ὁ","lexemeKey":"ho","maculaLexemeId":"grc-o-677c59","morph":"T-ASF","strongs":["3588"],"fw":true},{"id":"n57001005004","i":4,"s":"ἀγάπην","lemma":"ἀγάπη","lexemeKey":"agape","maculaLexemeId":"grc-agape-088e06","morph":"N-ASF","strongs":["26"],"fw":false},{"id":"n57001005005","i":5,"s":"καὶ","lemma":"καί","lexemeKey":"kai","maculaLexemeId":"grc-kai-85ac83","morph":"CONJ","strongs":["2532"],"fw":true},{"id":"n57001005006","i":6,"s":"τὴν","lemma":"ὁ","lexemeKey":"ho","maculaLexemeId":"grc-o-677c59","morph":"T-ASF","strongs":["3588"],